"success","trial_type","trial_index","time_elapsed","internal_node_id","screen_width","screen_height","rt","stimulus","key_press","subj_id","test_part","url","completion_code","inner_height","total_reading_time","total_scrolls","num_scrolls_up","scroll_type","scroll_time","scroll_duration","scroll_depth","onscreen_at_scroll","heading_depths","paragraph_depths","typos","typo_indices","typos_per_paragraph","num_typos_found","clicked_typos","clicked_typo_locations","clicked_typo_times","false_alarms","false_alarm_locations","false_alarm_times","expt_condition","response","responses","resp_age","resp_gender","resp_encountered","resp_article","resp_experiment","resp_experience","resp_mouse","resp_final","resp_attention"
"true","fullscreen","0","4302","0.0-0.0","1536","864","","","","","","","","","","","","","","","","","","","","","","","","","","","","","","","","","","","","","","","",""
"","html-keyboard-response","1","8694","0.0-1.0","1536","864","4386.10000038147","<h5>In order to run this study, we need to include the standard consent form below.</h5><h3>Please read and press the Y key to continue.</h3><h1>Consent for Participation in a Research Study</h1><div style='width: 100%; text-align: center'><div style='display: inline-block; margin: 0 auto; padding: 10px 200px 10px 200px; text-align: left'><h5>STUDY TITLE</h5><p>Perceiving Objects and Events</p><h5>RESEARCH STUDY SUMMARY, RISKS, AND BENEFITS</h5><p>Thank you for volunteering to participate in this research study. The purpose of this study is to better understand how we see and how we think. Study activities will include examining simple displays and then responding by answering questions, pressing some keys, or using a computer mouse. Because these are activities that many people already experience hundreds or thousands of times every day, there are no risks involved in this study. The study may have no benefits to you, but it may help the scientific community come to better understand how the human mind works. Taking part in this study is your choice. You can choose to take part, or you can choose not to take part in this study. You can also change your mind at any time, with no penalty.</p><h5>DURATION</h5><p>If you agree to take part, the study will last approximately <strong> 12 minutes</strong>.</p><h5>COSTS AND COMPENSATION</h5><p>There are no costs associated with participation in this study. You will receive <strong>$1.62</strong> for participating.</p><h5>CONFIDENTIALITY</h5><p>No personally identifying information will be collected, so your participation will be anonymous. Your data will be pooled with those from other participants, and may be included in scientific publications and uploaded to public data repositories.</p><h5>LEARNING MORE</h5><p>If you have questions about this study, you may contact your experimenter Joan Ongchoco at joan.ongchoco@yale.edu. If you have questions about your rights as a research participant, or you have complaints about this research, you can contact the Yale Institutional Review Boards at 203-785-4688 or hrpp@yale.edu.</p><h5>INFORMED CONSENT</h5><p>Your participation indicates that you have read and understood this consent form and the information presented and that you agree to be in this study.</p></div></div><h2 style='text-align: center'>PRESS THE Y KEY TO CONSENT</h2><p></p><p></p>","89","58a43e029a17120001d910d5_1650030665496","consent","https://perceptionexperiments.net/JD/exehe/expt.html","","","","","","","","","","","","","","","","","","","","","","","","","","","","","","","","","",""
"","jo-html-keyboard-response","2","39906","0.0-2.0","","","31207.199999809265","<p>First, a quick note: Throughout this experiment, you will see greyed out text as in the last line below.</p><p>This text will contain the instructions for how to move to the next page -- which will typically involve pressing the spacebar.  You will not be able to press the spacebar until after a brief period of time has elapsed.  Please use that time to read the instructions on the given page.  Once the greyed out text has turned black, and you have finished reading the instructions, you will then be able to proceed by pressing the relevant key.</p>","null","58a43e029a17120001d910d5_1650030665496","audio_check","","4D93CD1C","","","","","","","","","","","","","","","","","","","","","","","","","","","","","","","","",""
"","jo-html-keyboard-response","3","99585","0.0-3.0","","","59677.400000572205","<p>In this experiment, you will read an article about a randomly assigned topic.  <p>The article will appear on the next page. You can scroll through the page using your mouse or trackpad.  We want you to read it at a <b>natural pace</b>, as you would any other online article that you chose to read -- not just <i>skimming</i> it (e.g. as you might if you were not sure that you wanted to read it in the first place), but also not <i>studying</i> it (e.g. as you might if you had to take a test on it in school).  We really just want you to read it at your own comfortable pace.  At the end of the experiment, we will ask you several questions about the information in the article.  <p>While you are reading, you may encounter occasional typos (e.g. misspelled words).  Whenever you notice a typo, please click on the word.  <p>For example, try clicking on: <p><span id = ""typo"">tihs</span></p><p>Note that all words turn purple when clicked, not just typos, so please do not click indiscriminately!  You should <b>not</b> actively hunt for typos (as you might if you were asked to <i>proofread</i> the article).  We just want you to click on the typos that you happen to notice while you are reading naturally.  In other words, <b>please read the article with an emphasis on understanding its content</b>.  <p>The article will take around 5 minutes to read, after which you can press the q key to proceed to the next section.  (We will remind you about that, so that you do not have to remember which key to press.)  Note that you will not be able to proceed until 5 minutes have elapsed. Please use this time to read the article in its entirety!","null","58a43e029a17120001d910d5_1650030665496","instruct_prompt","","","","","","","","","","","","","","","","","","","","","","","","","","","","","","","","","","",""
