"success","trial_type","trial_index","time_elapsed","internal_node_id","screen_width","screen_height","rt","stimulus","key_press","subj_id","test_part","url","completion_code","inner_height","total_reading_time","total_scrolls","num_scrolls_up","scroll_type","scroll_time","scroll_duration","scroll_depth","onscreen_at_scroll","heading_depths","paragraph_depths","typos","typo_indices","typos_per_paragraph","num_typos_found","clicked_typos","clicked_typo_locations","clicked_typo_times","false_alarms","false_alarm_locations","false_alarm_times","expt_condition","response","responses","resp_age","resp_gender","resp_encountered","resp_article","resp_experiment","resp_experience","resp_mouse","resp_final","resp_attention"
"","html-slider-response","10","1082662","0.0-10.0","","","7172","To what extent did you gain or lose interest in this article over time?","","58a43e029a17120001d910d5_1650030665496","extra_q4","","","","","","","","","","","","","","","","","","","","","","","","heading","94","","","","","","","","","",""
"","jd-html-slider-response","11","1090548","0.0-11.0","","","7882.800000190735","Using the slider below, indicate which section of the article you found <b>most</b> interesting and enjoyable.","","58a43e029a17120001d910d5_1650030665496","extra_q5","","","","","","","","","","","","","","","","","","","","","","","","heading","100","","","","","","","","","",""
"","jd-html-slider-response","12","1104642","0.0-12.0","","","14090.099999427795","Using the slider below, indicate which section of the article you found <b>least</b> interesting and enjoyable.","","58a43e029a17120001d910d5_1650030665496","extra_q6","","","","","","","","","","","","","","","","","","","","","","","","heading","11","","","","","","","","","",""
"true","fullscreen","13","1105664","0.0-13.0","1536","760","","","","","","","","","","","","","","","","","","","","","","","","","","","","","","","","","","","","","","","",""
"","survey-html-form","14","1209167","0.0-14.0-0.0","","","103497.5","","","58a43e029a17120001d910d5_1650030665496","debrief","","4D93CD1C","","","","","","","","","","","","","","","","","","","","","","","","{""age"":""39"",""gender"":""female"",""3_article"":""It was about how humans are causing climate change and hurting the environment, which in turn is killing off animal species, and in turn that is killing off plants. "",""3_experiment"":""I am guessing it was about focus and attentiveness."",""encountered"":""no"",""4_experience"":""No"",""5_mouse"":""trackpad"",""6_final"":""no"",""7_attention"":""98""}","39","female","no","It was about how humans are causing climate change and hurting the environment, which in turn is killing off animal species, and in turn that is killing off plants. ","I am guessing it was about focus and attentiveness.","No","trackpad","no","98"
"","html-keyboard-response","15","1211311","0.0-15.0","","","2137.8999996185303","<p>Great, you have completed this experiment.  Please press spacebar to proceed to the next page, and get your code.</p>","32","58a43e029a17120001d910d5_1650030665496","instruct_prompt","","","","","","","","","","","","","","","","","","","","","","","","","","","","","","","","","","",""
